<?xml version="1.0" encoding="UTF-8"?>
<?xml-stylesheet type="text/css" href="./employee.css" ?>
<employees xmlns:xsi="http://www.w3.org/2001/XMLSchema-instance" xsi:noNamespaceSchemaLocation="file:///D:/ITI/ITI%20-%20Open%20Source%20Development/XML%20Fundamentals/Lab3/employees%20XSD%20Schema/employee.xsd">
	<employee isbn="1">
		<name>Nada</name>
		<phones>
			<phone type="home">0312345678</phone>
			<phone type="work">0391111567</phone>
			<phone type="mobile">01011145678</phone>
		</phones>
		<addresses>
			<address>
				<street>st1,</street> 
				<buildingNumber>21,</buildingNumber> 
				<Region>Sidi Bishr,</Region> 
				<city>Alex,</city> 
				<country>Egypt.</country>
			</address> 
			<address>
				<street>st2,</street> 
				<buildingNumber>21,</buildingNumber> 
				<Region>AlMndra,</Region> 
				<city>Alex,</city> 
				<country>Egypt.</country>
			</address>
		</addresses>
		<email>nada@gmail.com</email>
	</employee>
	<employee isbn="1">
		<name>Nourhan</name>
		<phones>
			<phone type="home">0312345678</phone>
			<phone type="work">0391234567</phone>
			<phone type="mobile">01011111178</phone>
		</phones>
		<addresses>
			<address>
				<street>st1,</street> 
				<buildingNumber>no1,</buildingNumber> 
				<Region>Sidi Bishr,</Region> 
				<city>Alex,</city> 
				<country>Egypt.</country>
			</address> 
		</addresses>
		<email>nourhan@gmail.com</email>
	</employee>
</employees>